{
  "vct": "uri:eu.ebw.oid.1",
  "id": "NOFOR.123456789",
  "name": "Example AS",
  "attestation_legal_category": "QEAA",
  "date_of_expiry": "2027-12-31",
  "issuing_authority": "NO",
  "issuing_country": "NO",
  "status": {
    "type": "status-list",
    "status_list_credential": "https://issuer.example.com/status/1",
    "status_list_index": 42,
    "status_purpose": "revocation"
  },
  "trust_anchor": "https://trust.example.org/anchors/qtsp/eidas-tl",
  "cnf": {
    "jwk": {
      "kty": "EC",
      "crv": "P-256",
      "x": "52aDI_ur05n1f_p3jiYGUU82oKZr3m4LsAErM536crQ",
      "y": "ckhZ-KQ5aXNL91R8Eufg1aOf8Z5pZJnIvuCzNGfdnzo"
    }
  }
}
